{
  "service": "api",
  "latency_ms": 2653,
  "tokens_in": 36,
  "tokens_out": 97,
  "cost_usd": 0.001563,
  "quality_score": 0.9,
  "payload": {
    "answer_preview": "Starter answer. Teams should improve this output logic and add better quality ch..."
  },
  "event": "response_sent",
  "user_id_hash": "2055254ee30a",
  "session_id": "s01",
  "feature": "qa",
  "env": "dev",
  "correlation_id": "req-0bd581bd",
  "model": "claude-sonnet-4-5",
  "level": "info",
  "ts": "2026-08-11T05:31:51.062169Z"
}